{
  "track_selected": "web_nextjs",
  "design_variant": "web",
  "web": {
    "pages": [
      {
        "name": "Home",
        "purpose": "",
        "components": [
          ""
        ]
      }
    ],
    "components": [
      {
        "name": "",
        "props": [
          ""
        ],
        "state": [
          ""
        ]
      }
    ],
    "data_flow": {
      "source": "mock",
      "shape": [
        {
          "field": "",
          "type": ""
        }
      ]
    },
    "acceptance_tests": [
      {
        "given": "",
        "when": "",
        "then": ""
      }
    ]
  },
  "kaggle": null,
  "hardware": null,
  "course": null
}